{
  "id": "filebrowser",
  "package": {
    "title": "File Browser",
    "version": "0.1.0",
    "icon": "ms-appx:///Trivial.WindowsKit/Assets/FolderLwa_128.png",
    "description": "Explore local files.",
    "copyright": "Copyright &copy; 2022 Kingcean Tuan, all rights reserved.",
    "website": "https://trivial.kingcean.net"
  },
  "ref": {
    "update": {
      "url": "http://localhost/install/Test/LocalWebApp.json"
    },
    "path": "..\\..\\bin\\LocalWebApp\\app",
    "sign": "RS256"
  },
  "dev": {
  }
}